Session,Date,Time,Project,Phase,Cost,Duration,Description,Session_ID
1,2025-06-12,21:30:00,Recall,Setup & Planning,2.83,59m 32s,Project init best practices setup GitHub issues,session_001
2,2025-06-12,22:15:00,Recall,Setup,0.74,37m 15s,Created cost tracking system with CSV and HTML dashboard,session_002
3,2025-06-12,22:30:00,Recall,Setup,0.03,8m 15s,Created cost tracking quick guide documentation,session_003
4,2025-06-12,12:37:11,MCP-Cost-Tracker,Development,2.75,45m,Test cost tracking functionality,session_1749767831
5,2025-06-12,17:04:53,MCP-Cost-Tracker,Development,2.75,45m,Test cost tracking functionality,session_1749783893
6,2025-06-12,17:04:55,MCP-Cost-Tracker,Testing,2.5,30m,MCP server test,session_1749783895
7,2025-06-12,20:15:14,MCP-Cost-Tracker,Development,2.75,45m,Test cost tracking functionality,session_1749795314
8,2025-06-12,20:15:19,MCP-Cost-Tracker,Testing,2.5,30m,MCP server test,session_1749795319
9,2025-06-12,20:56:00,MCP-Cost-Tracker,Testing,1.25,15m,Testing tc command functionality,session_1749797760
10,2025-06-12,21:05:04,MCP-Cost-Tracker,Development,0.35,25m,Initialized git repository and published MCP Cost Tracker to GitHub,session_1749798304
11,2025-06-12,21:10:44,MCP-Cost-Tracker,Testing,0.25,10m,Testing enhanced dashboard with session numbers and project totals,session_1749798644
12,2025-06-12,21:11:49,MCP-Cost-Tracker,Development,0.42,20m,Added session numbering and project total calculation to dashboard,session_1749798709
